{"lens": "builder", "base_sha256": "01d4eb4cfda763434165dbc013b541bb5a35286be21c730d2dd8db3103a8cbf5", "base_model_sha256": "01d4eb4cfda763434165dbc013b541bb5a35286be21c730d2dd8db3103a8cbf5", "source_sha256": "c35b21d6ca39aa7cc3b79a705d989f1a6e88b99ab43988d74048799e3db926a3", "lens_contract_version": "1.0", "prompt_version": "1.0", "executor": {"host": "test", "tool_profile": "paper-only"}, "findings": [], "notes": ""}